{
  "schema_version": "v0",
  "case_id": "labtrust-valid-release-v0",
  "task_id": "labtrust-qc-release-reproducibility-v0",
  "workflow_id": "hospital_lab.qc_release",
  "case_kind": "valid_release",
  "input_artifacts": {
    "release_dir": "input_artifacts/"
  },
  "expected_status": "Admitted",
  "expected_failure_code": null,
  "expected_responsible_component": null,
  "expected_repair_hint_kind": null,
  "source_repo": "https://github.com/fraware/LabTrust-Gym",
  "source_commit": "placeholder",
  "signature_or_digest": "sha256:0000000000000000000000000000000000000000000000000000000000000000"
}
